<?xml version="1.0" encoding="UTF-8" standalone="no"?>
<xs:schema xmlns:xs="http://www.w3.org/2001/XMLSchema" xmlns="https://draagon.com/schema/metamodel/simple" elementFormDefault="qualified" targetNamespace="https://draagon.com/schema/metamodel/simple">
  <xs:element name="metadata">
    <xs:complexType>
      <xs:choice maxOccurs="unbounded">
        <xs:element maxOccurs="unbounded" minOccurs="0" ref="object"/>
        <xs:element maxOccurs="unbounded" minOccurs="0" ref="field"/>
        <xs:element maxOccurs="unbounded" minOccurs="0" ref="validator"/>
      </xs:choice>
      <xs:attribute name="package">
        <xs:simpleType>
          <xs:restriction base="xs:string"/>
        </xs:simpleType>
      </xs:attribute>
    </xs:complexType>
  </xs:element>
  <xs:element name="attr">
    <xs:complexType>
      <xs:simpleContent>
        <xs:extension base="xs:string">
          <xs:attribute name="package">
            <xs:simpleType>
              <xs:restriction base="xs:string"/>
            </xs:simpleType>
          </xs:attribute>
          <xs:attribute name="name">
            <xs:simpleType>
              <xs:restriction base="xs:string"/>
            </xs:simpleType>
          </xs:attribute>
          <xs:attribute name="type">
            <xs:simpleType>
              <xs:restriction base="xs:string"/>
            </xs:simpleType>
          </xs:attribute>
          <xs:attribute name="super">
            <xs:simpleType>
              <xs:restriction base="xs:string"/>
            </xs:simpleType>
          </xs:attribute>
        </xs:extension>
      </xs:simpleContent>
    </xs:complexType>
  </xs:element>
  <xs:element name="object">
    <xs:complexType>
      <xs:choice maxOccurs="unbounded">
        <xs:element maxOccurs="unbounded" minOccurs="0" ref="attr"/>
        <xs:element maxOccurs="unbounded" minOccurs="0" ref="key"/>
        <xs:element maxOccurs="unbounded" minOccurs="0" ref="field"/>
      </xs:choice>
      <xs:attribute name="package">
        <xs:simpleType>
          <xs:restriction base="xs:string"/>
        </xs:simpleType>
      </xs:attribute>
      <xs:attribute name="name">
        <xs:simpleType>
          <xs:restriction base="xs:string"/>
        </xs:simpleType>
      </xs:attribute>
      <xs:attribute name="type">
        <xs:simpleType>
          <xs:restriction base="xs:string"/>
        </xs:simpleType>
      </xs:attribute>
      <xs:attribute name="super">
        <xs:simpleType>
          <xs:restriction base="xs:string"/>
        </xs:simpleType>
      </xs:attribute>
      <xs:attribute name="_isAbstract">
        <xs:simpleType>
          <xs:restriction base="xs:boolean"/>
        </xs:simpleType>
      </xs:attribute>
      <xs:attribute name="isInterface">
        <xs:simpleType>
          <xs:restriction base="xs:boolean"/>
        </xs:simpleType>
      </xs:attribute>
      <xs:attribute name="object">
        <xs:simpleType>
          <xs:restriction base="xs:string"/>
        </xs:simpleType>
      </xs:attribute>
      <xs:attribute name="proxyObject">
        <xs:simpleType>
          <xs:restriction base="xs:string"/>
        </xs:simpleType>
      </xs:attribute>
    </xs:complexType>
  </xs:element>
  <xs:element name="key">
    <xs:complexType>
      <xs:choice maxOccurs="unbounded">
        <xs:element maxOccurs="unbounded" minOccurs="0" ref="attr"/>
      </xs:choice>
      <xs:attribute name="package">
        <xs:simpleType>
          <xs:restriction base="xs:string"/>
        </xs:simpleType>
      </xs:attribute>
      <xs:attribute name="name">
        <xs:simpleType>
          <xs:restriction base="xs:string"/>
        </xs:simpleType>
      </xs:attribute>
      <xs:attribute name="type">
        <xs:simpleType>
          <xs:restriction base="xs:string"/>
        </xs:simpleType>
      </xs:attribute>
      <xs:attribute name="super">
        <xs:simpleType>
          <xs:restriction base="xs:string"/>
        </xs:simpleType>
      </xs:attribute>
      <xs:attribute name="keys">
        <xs:simpleType>
          <xs:restriction base="xs:string"/>
        </xs:simpleType>
      </xs:attribute>
      <xs:attribute name="foreignObjectRef">
        <xs:simpleType>
          <xs:restriction base="xs:string"/>
        </xs:simpleType>
      </xs:attribute>
      <xs:attribute name="foreignKey">
        <xs:simpleType>
          <xs:restriction base="xs:string"/>
        </xs:simpleType>
      </xs:attribute>
    </xs:complexType>
  </xs:element>
  <xs:element name="field">
    <xs:complexType>
      <xs:choice maxOccurs="unbounded">
        <xs:element maxOccurs="unbounded" minOccurs="0" ref="attr"/>
        <xs:element maxOccurs="unbounded" minOccurs="0" ref="validator"/>
      </xs:choice>
      <xs:attribute name="package">
        <xs:simpleType>
          <xs:restriction base="xs:string"/>
        </xs:simpleType>
      </xs:attribute>
      <xs:attribute name="name">
        <xs:simpleType>
          <xs:restriction base="xs:string"/>
        </xs:simpleType>
      </xs:attribute>
      <xs:attribute name="type">
        <xs:simpleType>
          <xs:restriction base="xs:string"/>
        </xs:simpleType>
      </xs:attribute>
      <xs:attribute name="super">
        <xs:simpleType>
          <xs:restriction base="xs:string"/>
        </xs:simpleType>
      </xs:attribute>
      <xs:attribute name="_isAbstract">
        <xs:simpleType>
          <xs:restriction base="xs:boolean"/>
        </xs:simpleType>
      </xs:attribute>
      <xs:attribute name="objectRef">
        <xs:simpleType>
          <xs:restriction base="xs:string"/>
        </xs:simpleType>
      </xs:attribute>
    </xs:complexType>
  </xs:element>
  <xs:element name="validator">
    <xs:complexType>
      <xs:choice maxOccurs="unbounded">
        <xs:element maxOccurs="unbounded" minOccurs="0" ref="attr"/>
      </xs:choice>
      <xs:attribute name="package">
        <xs:simpleType>
          <xs:restriction base="xs:string"/>
        </xs:simpleType>
      </xs:attribute>
      <xs:attribute name="name">
        <xs:simpleType>
          <xs:restriction base="xs:string"/>
        </xs:simpleType>
      </xs:attribute>
      <xs:attribute name="type">
        <xs:simpleType>
          <xs:restriction base="xs:string"/>
        </xs:simpleType>
      </xs:attribute>
      <xs:attribute name="super">
        <xs:simpleType>
          <xs:restriction base="xs:string"/>
        </xs:simpleType>
      </xs:attribute>
      <xs:attribute name="mask">
        <xs:simpleType>
          <xs:restriction base="xs:string"/>
        </xs:simpleType>
      </xs:attribute>
      <xs:attribute name="min">
        <xs:simpleType>
          <xs:restriction/>
        </xs:simpleType>
      </xs:attribute>
      <xs:attribute name="max">
        <xs:simpleType>
          <xs:restriction/>
        </xs:simpleType>
      </xs:attribute>
      <xs:attribute name="minSize">
        <xs:simpleType>
          <xs:restriction/>
        </xs:simpleType>
      </xs:attribute>
      <xs:attribute name="maxSize">
        <xs:simpleType>
          <xs:restriction/>
        </xs:simpleType>
      </xs:attribute>
    </xs:complexType>
  </xs:element>
</xs:schema>
